[
  {
    "id": "ltm_2dd139840b4d",
    "content": "System consists of 4 modules: Analytics, UI, Database, API. Analytics handles data processing.",
    "project_id": "innocody-demo",
    "metadata": {
      "category": "architecture",
      "embedding": [
        0.8689406819897616,
        0.3053170410806041,
        0.5925340942838105,
        0.6243386141272564,
        0.3491169593322496,
        0.9771454763030368,
        0.7354982490234083,
        0.33668897898976924,
        0.7920873178694748,
        0.5267055141339915,
        0.8245795399290806,
        0.8512664733258255,
        0.42173180655222586,
        0.7822230976990341,
        0.3201212155520581,
        0.5718769090218818,
        0.269934053248167,
        0.1903304209255996,
        0.728399871675235,
        0.45480102651159826,
        0.3123915153932164,
        0.4072353509054578,
        0.7413382036476599,
        0.0025137992665963393,
        0.6078509742109779,
        0.07868356468113424,
        0.14724270289321006,
        0.22682125244323192,
        0.8490716918281802,
        0.44724205798294847,
        0.7711792188212726,
        0.3712914710767168,
        0.74215231383901,
        0.4767483540000852,
        0.1120747936505454,
        0.4953133257146437,
        0.164956253956816,
        0.14207929193507451,
        0.04295312739787349,
        0.24157724108542367,
        0.46029866777595907,
        0.26026558022330215,
        0.9113178466605173,
        0.3593051024669459,
        0.9325269059582031,
        0.37135261420333643,
        0.41701284258715854,
        0.6031694695255347,
        0.4612679262935271,
        0.560275877253191,
        0.36878152888294036,
        0.34481101719145457,
        0.7238630188474545,
        0.20728008163668188,
        0.9747401315622594,
        0.9251336303964279,
        0.727931810734019,
        0.45699037559141287,
        0.47084504979218544,
        0.09213520680519216,
        0.5648663896134415,
        0.17841903745568077,
        0.21952348630116048,
        0.40122909357937186,
        0.6845022799676036,
        0.3975201446833776,
        0.7967916289704272,
        0.9806642959116345,
        0.6313686897635725,
        0.16137197189940655,
        0.7909701226107267,
        0.20548760569058444,
        0.4293817598706092,
        0.5106103694389436,
        0.28390840045332644,
        0.532637290928054,
        0.3167246245075013,
        0.5689117417444922,
        0.1768084322395036,
        0.14367716096795546,
        0.4625563163722738,
        0.6441448129600452,
        0.12891201645316475,
        0.5035645100763191,
        0.37820032664623726,
        0.7727783393733922,
        0.3346992455255171,
        0.06831581648731522,
        0.46991710990622915,
        0.9843487732046206,
        0.544157428308657,
        0.7773727731935332,
        0.34981287557673457,
        0.8052741477700294,
        0.10469989924550172,
        0.15789581511014827,
        0.6688027965346097,
        0.6880883533657816,
        0.6247099104194952,
        0.23754459299229225,
        0.9335146856158084,
        0.6314619627140283,
        0.1263891595209523,
        0.4439469356395016,
        0.7138293911850506,
        0.6104393927972518,
        0.8191462418749546,
        0.27800140530827155,
        0.830495792814432,
        0.7989434774365738,
        0.5080357617557372,
        0.28542447976336605,
        0.09919441442467225,
        0.014319966861682798,
        0.01700493885687293,
        0.8938799569159236,
        0.7686110585887531,
        0.2017310068003978,
        0.19403929686691912,
        0.5609904753900598,
        0.2797411362528375,
        0.5838847757522929,
        0.6013337832006408,
        0.016910898763984328,
        0.415055989563513,
        0.8378959035587495,
        0.6613536612025724,
        0.8647521610131819,
        0.9394351236361914,
        0.7403361168635053,
        0.10094776866103106,
        0.8174637115773249,
        0.6671591305089095,
        0.976982313603772,
        0.0863944459650825,
        0.6939381564120758,
        0.485289390054228,
        0.19002958876119547,
        0.8889511732502353,
        0.8749138740832864,
        0.14527249608093562,
        0.9887861117937015,
        0.6187461749266551,
        0.584726793346186,
        0.295593798066917,
        0.7936688266367025,
        0.8015777987362643,
        0.2132776267423404,
        0.3572158075451304,
        0.6985665686413522,
        0.09629220841148567,
        0.3730263794213058,
        0.9039295511849462,
        0.8437003176139898,
        0.5062543478224587,
        0.6139132134219957,
        0.6398798241728973,
        0.17363172183511788,
        0.5018947746627318,
        0.37829729781541077,
        0.3785915630847144,
        0.8470835410119498,
        0.32186296362382516,
        0.11127276962726063,
        0.621653059834362,
        0.6631624887189509,
        0.3915899360334637,
        0.5155975697257615,
        0.3349890660087049,
        0.6353263774042596,
        0.5293425314947049,
        0.1305731954683993,
        0.20933424901495445,
        0.6891237913734076,
        0.7440110207449738,
        0.5009668235265776,
        0.5434830330610633,
        0.2714163375232703,
        0.7329077187891776,
        0.9750294779410016,
        0.933197266060636,
        0.7848010189490263,
        0.042373247804243896,
        0.49896415245592396,
        0.8795114080076887,
        0.6664541286359102,
        0.20497613783352286,
        0.46210434220856234,
        0.8308238686777477,
        0.028572282339986876,
        0.11243384555997549,
        0.7283389895791856,
        0.14928747021372646,
        0.5969321020911466,
        0.16744063820948574,
        0.2417180818782586,
        0.7437501398677981,
        0.7927119736574657,
        0.5777826324780554,
        0.699446748323402,
        0.5401403326026263,
        0.6544505291127494,
        0.5333979706874075,
        0.6740391985367926,
        0.3966812077298264,
        0.4760524229001042,
        0.03506656525242835,
        0.7552978662302147,
        0.7810946459790153,
        0.6123104392597959,
        0.9692719794322199,
        0.05822676165566776,
        0.3869074037000455,
        0.28618776251651323,
        0.2548186305319754,
        0.4890521928718553,
        0.6331038351137809,
        0.08109321773065181,
        0.1514936416260111,
        0.3342495103086114,
        0.969123131458715,
        0.9378666392700975,
        0.45971588460230606,
        0.8914573811249323,
        0.8832648627650374,
        0.09287121645932783,
        0.19587968975651493,
        0.21379085764691996,
        0.7181338156557475,
        0.888339678887692,
        0.16285849205210512,
        0.8939473861991595,
        0.2310029758923301,
        0.7491102914815638,
        0.935618059704281,
        0.2618222270449043,
        0.8355338487806846,
        0.12448248006275697,
        0.16100483180800518,
        0.4394789240973921,
        0.10411883431570079,
        0.3699955828222766,
        0.5007472772218501,
        0.03182790615344788,
        0.864605392003724,
        0.9397634534258948,
        0.7342450507734251,
        0.3126958829925526,
        0.7194180844175921,
        0.36453273111167883,
        0.8919491003115193,
        0.5554873552261352,
        0.12730475681754172,
        0.9650111396572046,
        0.779539175267439,
        0.8665843492026302,
        0.6925835401180139,
        0.3221549165977471,
        0.2954903726359188,
        0.47494937145843563,
        0.24544971009694672,
        0.05755780882780026,
        0.7262965323168135,
        0.38361523175637213,
        0.5214038263064831,
        0.8449686966227702,
        0.1445306096323843,
        0.6859315156514691,
        0.5506335598873829,
        0.5056697717132325,
        0.654951146644587,
        0.23452088347994315,
        0.8885837418758239,
        0.36946328621227353,
        0.9190834773772886,
        0.46378882261893706,
        0.7234405761948353,
        0.30451181100989777,
        0.33874280926478495,
        0.21209066616380667,
        0.4020536759938219,
        0.7931871745175645,
        0.441751270636335,
        0.9822696353092136,
        0.3161537630715159,
        0.956966947405517,
        0.8777898923311908,
        0.9970464122531051,
        0.9295925856095342,
        0.25355025228084305,
        0.040966597079826195,
        0.6874914564970955,
        0.9600407599072409,
        0.6828399414048926,
        0.29020582930103755,
        0.06260980163928498,
        0.31115254167745454,
        0.8337922537628782,
        0.9625572914133069,
        0.1112388454020703,
        0.4872547473415464,
        0.14836012626633321,
        0.11914695054455282,
        0.5376867553740672,
        0.288449909471579,
        0.9715842235200469,
        0.5294657038312804,
        0.4824872379031985,
        0.6288219180489867,
        0.5552194060225941,
        0.5154981483583148,
        0.4297039714208749,
        0.4053495456176317,
        0.21003843043340198,
        0.8809639570194542,
        0.42151158415483014,
        0.9470150718413806,
        0.40644925363316153,
        0.6440605177226485,
        0.6058901703723771,
        0.3074002535237913,
        0.565693566057408,
        0.6727165938161062,
        0.2242850303420294,
        0.2120368242082603,
        0.460745718915629,
        0.23865793453697248,
        0.6158077722798351,
        0.46586258033731454,
        0.6802415954494512,
        0.20304274491529262,
        0.7592324152092467,
        0.5512599898890493,
        0.967997853532405,
        0.5516223336411099,
        0.8430827096558151,
        0.29732207271628486,
        0.8712880591362967,
        0.6481398351615507,
        0.9274281450891468,
        0.47780310750737254,
        0.7640248375740905,
        0.31802553339972306,
        0.2126556783125535,
        0.6513246746544168,